{
  "kind": "foiled.release.v1",
  "product": "foiled-hostd",
  "version": "0.2.0",
  "released_at": 1800000000000,
  "artefacts": [
    {
      "target": "x86_64-unknown-linux-gnu",
      "file": "foiled-hostd-x86_64-unknown-linux-gnu",
      "sha256": "9f86d081884c7d659a2feaa0c55ad015a3bf4f1b2b0b822cd15d6c15b0f00a08",
      "size": 4
    },
    {
      "target": "aarch64-unknown-linux-gnu",
      "file": "foiled-hostd-aarch64-unknown-linux-gnu",
      "sha256": "60303ae22b998861bce3b28f33eec1be758a213c86c93c076dbe9f558c11c752",
      "size": 4
    }
  ]
}
